{
  "slug": "tomato-late-blight-wikimedia-01",
  "version": 1,
  "status": "draft",
  "type": "image",
  "hosting": "external_link",
  "external_url": "https://upload.wikimedia.org/wikipedia/commons/9/9f/Potato_Late_Blight.JPG",
  "credit": "Björn Andersson (SLU) via Wikimedia Commons",
  "licence": "CC-BY-SA-4.0",
  "caption": {
    "en": "Late blight (Phytophthora infestans) infection on a potato leaf — same pathogen, identical foliar symptoms on tomato. Note the water-soaked lesions with grey-white sporulation at the margins."
  },
  "related": {
    "disease_slug": "tomato-late-blight"
  },
  "language": "en",
  "tags": ["late_blight", "phytophthora_infestans", "leaf_symptoms", "wikimedia_commons"]
}
